{
  "name": "Helo1",
  "members": [
    {
      "mechCreatorUUID": "",
      "customName": "",
      "currentArmor": [
        false
      ],
      "currentStructure": [
        false,
        false
      ],
      "engineHits": [
        false,
        false
      ],
      "fireControlHits": [
        false,
        false,
        false,
        false
      ],
      "mpControlHits": [
        false,
        false,
        false,
        false,
        false
      ],
      "weaponHits": [
        false,
        false,
        false,
        false
      ],
      "vehicleMotive910": [
        false,
        false
      ],
      "vehicleMotive11": [
        false,
        false
      ],
      "vehicleMotive12": false,
      "roundArmor": [
        false
      ],
      "roundStructure": [
        false,
        false
      ],
      "roundEngineHits": [
        false,
        false
      ],
      "roundFireControlHits": [
        false,
        false,
        false,
        false
      ],
      "roundMpControlHits": [
        false,
        false,
        false,
        false,
        false
      ],
      "roundWeaponHits": [
        false,
        false,
        false,
        false
      ],
      "roundVehicleMotive910": [
        false,
        false
      ],
      "roundVehicleMotive11": [
        false,
        false
      ],
      "roundVehicleMotive12": false,
      "roundHeat": 0,
      "classification": "",
      "class": "Asgard Missile VTOL",
      "costCR": 713150.0,
      "mulID": 0,
      "currentHeat": 0,
      "damage": {
        "short": 2,
        "medium": 2,
        "long": 0,
        "extreme": 0,
        "shortMinimal": false,
        "mediumMinimal": false,
        "longMinimal": false,
        "extremeMinimal": false
      },
      "variant": "AG-12",
      "dateIntroduced": "2974",
      "name": "Asgard Missile VTOL",
      "tmm": 4.0,
      "tonnage": 25.0,
      "tro": "",
      "role": "Missile Boat",
      "threshold": 0,
      "pilot": {
        "name": "",
        "piloting": 5,
        "gunnery": 4,
        "wounds": 0,
        "alphaStrikeAbilities": [
          0,
          0,
          0
        ]
      },
      "imageURL": "https://i.ibb.co/8XvbKfW/warrior-attack-helicopter-rg.png",
      "move": [
        {
          "move": 20,
          "currentMove": 20,
          "type": "v"
        }
      ],
      "jumpMove": 0,
      "structure": 2,
      "armor": 2,
      "type": "CV",
      "size": 1,
      "showDetails": false,
      "abilities": [
        "ATMO",
        "EE",
        "SRCH",
        "SRM 1/1"
      ],
      "overheat": 0,
      "basePoints": 26,
      "currentSkill": 4,
      "uuid": "5fd7a9d3-cee6-4728-a70e-95ad5c310964"
    }
  ],
  "uuid": "e95a317a-da8b-471b-a461-2454ab832624",
  "lastUpdated": "2025-10-27T20:18:30.573347",
  "formationBonus": "None",
  "groupLabel": "Lance"
}