{"name":"Helo1","members":[{"mechCreatorUUID":"","customName":"","currentArmor":[false],"currentStructure":[false,false],"engineHits":[false,false],"fireControlHits":[false,false,false,false],"mpControlHits":[false,false,false,false,false],"weaponHits":[false,false,false,false],"vehicleMotive910":[false,false],"vehicleMotive11":[false,false],"vehicleMotive12":false,"roundArmor":[false],"roundStructure":[false,false],"roundEngineHits":[false,false],"roundFireControlHits":[false,false,false,false],"roundMpControlHits":[false,false,false,false,false],"roundWeaponHits":[false,false,false,false],"roundVehicleMotive910":[false,false],"roundVehicleMotive11":[false,false],"roundVehicleMotive12":false,"roundHeat":0,"classification":"","class":"Warrior Attack Helicopter","costCR":713150,"mulID":3515,"currentHeat":0,"damage":{"short":1,"medium":2,"long":1,"extreme":0,"shortMinimal":false,"mediumMinimal":false,"longMinimal":false,"extremeMinimal":false},"variant":"H-7C","dateIntroduced":"2974","name":"Warrior Attack Helicopter H-7C","tmm":0,"tonnage":21,"tro":"TR:3039","role":"Sniper","threshold":0,"pilot":{"name":"","piloting":5,"gunnery":4,"wounds":0,"alphaStrikeAbilities":[0,0,0]},"imageURL":"https://i.ibb.co/8XvbKfW/warrior-attack-helicopter-rg.png","move":[{"move":18,"currentMove":18,"type":"v"}],"jumpMove":0,"structure":2,"armor":1,"type":"CV","size":1,"showDetails":false,"abilities":["ATMO","EE","IF1","SRCH"],"overheat":0,"basePoints":20,"currentSkill":4,"uuid":"0ad0d7d8-76b6-4882-87eb-90790ee14c2f"}],"uuid":"cea99f51-095d-4b87-0b11-78e2a8618604","lastUpdated":"2025-10-27T23:06:37.771Z","formationBonus":"None","groupLabel":"Lance"}